{
 "$schema": "https://vomaste.cz/schemas/canonical/entity.schema.json",
 "schemaVersion": 1,
 "@context": "https://vomaste.cz/context/v1.jsonld",
 "@id": "https://vomaste.cz/id/entities/alicja-knastova",
 "@type": "vomaste:Entity",
 "recordType": "entity",
 "identifier": "alicja-knastova",
 "entityId": "alicja-knastova",
 "title": "Alicja Knastová",
 "entityType": "person",
 "publicationRole": "context",
 "dossierEnabled": false,
 "dossierStatus": "not_authorized",
 "coverageState": "discovered",
 "dossiers": [
  "oto-klempir"
 ],
 "order": 62,
 "provenance": {
  "discoveredAt": "2026-08-02",
  "discoveredVia": [
   "content-extraction-2026-08-02"
  ],
  "claimRefs": [
   "CLM-25"
  ]
 },
 "content": [
  {
   "type": "markdown",
   "value": "Kontextová entita — Generální ředitelka Národní galerie Praha odvolaná Klempířem v březnu 2026; způsob odvolání kritizovala UHS. Uvedena, protože se jmenovitě objevuje v citovaném obsahu autorizovaných dossierů (oto-klempir). Tato stránka neobsahuje samostatný profil mimo tento kontext a nezakládá žádné tvrzení o pochybení."
  }
 ]
}
