{
  "$schema": "https://vomaste.cz/schemas/canonical/entity.schema.json",
  "schemaVersion": 1,
  "@context": "https://vomaste.cz/context/v1.jsonld",
  "@id": "https://vomaste.cz/id/entities/marcela-pribylova",
  "@type": "vomaste:Entity",
  "recordType": "entity",
  "identifier": "marcela-pribylova",
  "entityId": "marcela-pribylova",
  "title": "Marcela Přibylová",
  "entityType": "person",
  "publicationRole": "subject",
  "dossierEnabled": true,
  "dossierStatus": "authorized",
  "coverageState": "referenced",
  "dossiers": [
    "marcela-pribylova"
  ],
  "order": 700,
  "description": "Marcela Přibylová — zastupitelka města Znojma (Naše Znojmo).",
  "provenance": {
    "discoveredAt": "2026-08-09",
    "discoveredVia": [
      "znojmo-council-research-2026-08-08"
    ],
    "depth": 1
  },
  "content": [
    {
      "type": "markdown",
      "value": "Zastupitelka města Znojma (Naše Znojmo).\n\nZáznam veřejné funkce, ne profil ani tvrzení o pochybení."
    }
  ]
}
