{
  "$schema": "https://vomaste.cz/schemas/canonical/entity.schema.json",
  "schemaVersion": 1,
  "@context": "https://vomaste.cz/context/v1.jsonld",
  "@id": "https://vomaste.cz/id/entities/pavel-dobes",
  "@type": "vomaste:Entity",
  "recordType": "entity",
  "identifier": "pavel-dobes",
  "entityId": "pavel-dobes",
  "title": "Pavel Dobeš",
  "entityType": "person",
  "publicationRole": "subject",
  "dossierEnabled": true,
  "dossierStatus": "authorized",
  "coverageState": "referenced",
  "dossiers": [
    "pavel-dobes"
  ],
  "order": 611,
  "description": "Pavel Dobeš — bývalý ministr dopravy (2011–2012).",
  "provenance": {
    "discoveredAt": "2026-08-08",
    "discoveredVia": [
      "government-roster-research-2026-08-08"
    ],
    "depth": 1
  },
  "content": [
    {
      "type": "markdown",
      "value": "Bývalý ministr dopravy (1. 7. 2011 – 3. 12. 2012, Nečasova vláda).\n\nZáznam veřejné funkce, ne profil ani tvrzení o pochybení."
    }
  ]
}
