{
  "$schema": "https://vomaste.cz/schemas/canonical/entity.schema.json",
  "schemaVersion": 1,
  "@context": "https://vomaste.cz/context/v1.jsonld",
  "@id": "https://vomaste.cz/id/entities/turek",
  "@type": "vomaste:Entity",
  "recordType": "entity",
  "identifier": "turek",
  "entityId": "turek",
  "title": "Filip Turek",
  "entityType": "person",
  "publicationRole": "subject",
  "dossierEnabled": true,
  "dossierStatus": "authorized",
  "coverageState": "full",
  "dossiers": [
    "macinka-turek",
    "filip-turek",
    "richard-chlad"
  ],
  "routeAliases": [
    "/dossiers/macinka-turek/entities/turek/"
  ],
  "order": 76,
  "content": [
    {
      "type": "markdown",
      "value": "Hlavní subjekt autorizovaného dossieru. Tato stránka je kanonický záznam\ntéto entity — dossiery, tvrzení, zdroje a vztahy v tabulce a sekcích níže\njsou úplné; nejde o zkrácenou verzi něčeho podrobnějšího jinde."
    }
  ]
}
