{
 "$schema": "https://vomaste.cz/schemas/canonical/entity.schema.json",
 "schemaVersion": 1,
 "@context": "https://vomaste.cz/context/v1.jsonld",
 "@id": "https://vomaste.cz/id/entities/kauza-pokuta-stret-zajmu-mrazova",
 "@type": "vomaste:Entity",
 "recordType": "entity",
 "identifier": "kauza-pokuta-stret-zajmu-mrazova",
 "entityId": "kauza-pokuta-stret-zajmu-mrazova",
 "title": "Nepravomocná pokuta Mrázové za střet zájmů",
 "entityType": "legal_or_administrative_process",
 "publicationRole": "context",
 "dossierEnabled": false,
 "dossierStatus": "not_authorized",
 "coverageState": "discovered",
 "dossiers": [
  "zuzana-mrazova"
 ],
 "order": 211,
 "provenance": {
  "discoveredAt": "2026-08-02",
  "discoveredVia": [
   "content-extraction-2026-08-02"
  ],
  "claimRefs": [
   "CLM-02",
   "CLM-03",
   "CLM-18",
   "CLM-20",
   "CLM-21",
   "CLM-24"
  ],
  "sourceRefs": [
   "SRC-02",
   "SRC-04",
   "SRC-05",
   "SRC-07",
   "SRC-13",
   "SRC-14",
   "SRC-20",
   "SRC-27"
  ]
 },
 "content": [
  {
   "type": "markdown",
   "value": "Kontextová entita — Přestupkové řízení Magistrátu Most za nepřiznanou půjčku 500 tis. Kč; rozhodnutí NEPRAVOMOCNÉ — uvádět při každé zmínce. Uvedena, protože se jmenovitě objevuje v citovaném obsahu autorizovaných dossierů (zuzana-mrazova). Tato stránka neobsahuje samostatný profil mimo tento kontext a nezakládá žádné tvrzení o pochybení."
  }
 ]
}
