{
 "$schema": "https://vomaste.cz/schemas/canonical/entity.schema.json",
 "schemaVersion": 1,
 "@context": "https://vomaste.cz/context/v1.jsonld",
 "@id": "https://vomaste.cz/id/entities/daniela-bartikova",
 "@type": "vomaste:Entity",
 "recordType": "entity",
 "identifier": "daniela-bartikova",
 "entityId": "daniela-bartikova",
 "title": "Daniela Bártíková",
 "entityType": "person",
 "publicationRole": "context",
 "dossierEnabled": false,
 "dossierStatus": "not_authorized",
 "coverageState": "discovered",
 "dossiers": [
  "andrej-babis"
 ],
 "order": 102,
 "provenance": {
  "discoveredAt": "2026-08-02",
  "discoveredVia": [
   "content-extraction-2026-08-02"
  ],
  "claimRefs": [
   "CLM-27"
  ],
  "sourceRefs": [
   "SRC-12"
  ]
 },
 "content": [
  {
   "type": "markdown",
   "value": "Kontextová entita — Evropská pověřená žalobkyně (EPPO) — 24. 5. 2026 vydala rozhodnutí o zahájení trestního řízení k vyplácení evropských dotací. Uvedena, protože se jmenovitě objevuje v citovaném obsahu autorizovaných dossierů (andrej-babis). Tato stránka neobsahuje samostatný profil mimo tento kontext a nezakládá žádné tvrzení o pochybení."
  }
 ]
}
