{
 "$schema": "https://vomaste.cz/schemas/canonical/entity.schema.json",
 "schemaVersion": 1,
 "@context": "https://vomaste.cz/context/v1.jsonld",
 "@id": "https://vomaste.cz/id/entities/incident-saudska-ambasada-2017",
 "@type": "vomaste:Entity",
 "recordType": "entity",
 "identifier": "incident-saudska-ambasada-2017",
 "entityId": "incident-saudska-ambasada-2017",
 "title": "Incident u saúdskoarabské ambasády (2017)",
 "entityType": "controversy",
 "publicationRole": "context",
 "dossierEnabled": false,
 "dossierStatus": "not_authorized",
 "coverageState": "discovered",
 "dossiers": [
  "macinka-turek"
 ],
 "order": 151,
 "provenance": {
  "discoveredAt": "2026-08-02",
  "discoveredVia": [
   "content-extraction-2026-08-02"
  ],
  "claimRefs": [
   "CLM-28",
   "CLM-29"
  ],
  "sourceRefs": [
   "SRC-32"
  ]
 },
 "content": [
  {
   "type": "markdown",
   "value": "Kontextová entita — Kresba oprátky a lovecká nábojnice na autě zaměstnance ambasády (zaměstnanec záměrně nejmenován — nezakládat pro něj entitu); policie uzavřela jako pravděpodobnou záměnu osob, přestupek. Uvedena, protože se jmenovitě objevuje v citovaném obsahu autorizovaných dossierů (macinka-turek). Tato stránka neobsahuje samostatný profil mimo tento kontext a nezakládá žádné tvrzení o pochybení."
  }
 ]
}
