{
  "$schema": "https://vomaste.cz/schemas/canonical/entity.schema.json",
  "schemaVersion": 1,
  "@context": "https://vomaste.cz/context/v1.jsonld",
  "@id": "https://vomaste.cz/id/entities/david-rath",
  "@type": "vomaste:Entity",
  "recordType": "entity",
  "identifier": "david-rath",
  "entityId": "david-rath",
  "title": "David Rath",
  "entityType": "person",
  "publicationRole": "subject",
  "dossierEnabled": true,
  "dossierStatus": "authorized",
  "coverageState": "referenced",
  "dossiers": [
    "david-rath"
  ],
  "order": 658,
  "description": "David Rath — bývalý ministr zdravotnictví (2005–2006).",
  "provenance": {
    "discoveredAt": "2026-08-08",
    "discoveredVia": [
      "government-roster-research-2026-08-08"
    ],
    "depth": 1
  },
  "content": [
    {
      "type": "markdown",
      "value": "Bývalý ministr zdravotnictví (4. 11. 2005 – 16. 8. 2006, vláda Jiřího Paroubka).\n\nZáznam veřejné funkce, ne profil ani tvrzení o pochybení."
    }
  ]
}
