{
  "externalIds": { "ares": "00215678" },
 "$schema": "https://vomaste.cz/schemas/canonical/entity.schema.json",
 "schemaVersion": 1,
 "@context": "https://vomaste.cz/context/v1.jsonld",
 "@id": "https://vomaste.cz/id/entities/krajsky-soud-praha",
 "@type": "vomaste:Entity",
 "recordType": "entity",
 "identifier": "krajsky-soud-praha",
 "entityId": "krajsky-soud-praha",
 "title": "Krajský soud v Praze",
 "entityType": "public_institution",
 "publicationRole": "context",
 "dossierEnabled": false,
 "dossierStatus": "not_authorized",
 "coverageState": "discovered",
 "dossiers": [
  "andrej-babis",
  "karel-havlicek"
 ],
 "order": 225,
 "provenance": {
  "discoveredAt": "2026-08-02",
  "discoveredVia": [
   "content-extraction-2026-08-02"
  ],
  "claimRefs": [
   "CLM-26",
   "CLM-57"
  ],
  "sourceRefs": [
   "SRC-15",
   "SRC-16",
   "SRC-34",
   "SRC-35"
  ]
 },
 "content": [
  {
   "type": "markdown",
   "value": "Kontextová entita — Soud, k němuž EPPO podalo obžalobu na Pekárnu Zelená louka. Uvedena, protože se jmenovitě objevuje v citovaném obsahu autorizovaných dossierů (andrej-babis, karel-havlicek). Tato stránka neobsahuje samostatný profil mimo tento kontext a nezakládá žádné tvrzení o pochybení."
  }
 ]
}
