{
  "$schema": "https://vomaste.cz/schemas/canonical/entity.schema.json",
  "schemaVersion": 1,
  "@context": "https://vomaste.cz/context/v1.jsonld",
  "@id": "https://vomaste.cz/id/entities/bohuslav-sobotka",
  "@type": "vomaste:Entity",
  "recordType": "entity",
  "identifier": "bohuslav-sobotka",
  "entityId": "bohuslav-sobotka",
  "title": "Bohuslav Sobotka",
  "entityType": "person",
  "publicationRole": "subject",
  "dossierEnabled": true,
  "dossierStatus": "authorized",
  "coverageState": "referenced",
  "dossiers": [
    "bohuslav-sobotka"
  ],
  "order": 566,
  "description": "Bohuslav Sobotka — bývalý předseda vlády ČR (2014–2017).",
  "provenance": {
    "discoveredAt": "2026-08-08",
    "discoveredVia": [
      "government-roster-research-2026-08-08"
    ],
    "depth": 1
  },
  "content": [
    {
      "type": "markdown",
      "value": "Bývalý předseda vlády ČR (29. 1. 2014 – 13. 12. 2017), ministr financí\na místopředseda vlády (2002–2006), předseda ČSSD (2011–2017).\n\nZáznam veřejné funkce, ne profil ani tvrzení o pochybení."
    }
  ],
  "media": [
    {
      "file": "images/people/bohuslav-sobotka.jpg",
      "sourceUrl": "https://commons.wikimedia.org/wiki/File:Tallinn_Digital_Summit._Arrivals_Bohuslav_Sobotka_(23536638518)_(cropped).jpg",
      "license": "CC BY 2.0",
      "licenseUrl": "https://creativecommons.org/licenses/by/2.0",
      "author": "EU2017EE Estonian Presidency",
      "credit": "Bohuslav Sobotka",
      "retrieved": "2026-08-10",
      "width": 1200,
      "height": 1485,
      "role": "portrait"
    }
  ]
}
