{
  "$schema": "https://vomaste.cz/schemas/canonical/entity.schema.json",
  "schemaVersion": 1,
  "@context": "https://vomaste.cz/context/v1.jsonld",
  "@id": "https://vomaste.cz/id/entities/spd",
  "@type": "vomaste:Entity",
  "recordType": "entity",
  "identifier": "spd",
  "entityId": "spd",
  "title": "SPD",
  "entityType": "political_party",
  "publicationRole": "context",
  "dossierEnabled": false,
  "dossierStatus": "not_authorized",
  "coverageState": "discovered",
  "dossiers": [
    "tomio-okamura"
  ],
  "routeAliases": [
    "/dossiers/tomio-okamura/entities/spd/"
  ],
  "order": 2,
  "provenance": {
    "discoveredAt": "2026-07-30",
    "discoveredVia": [
      "edge-okamura-spd",
      "edge-spd-obvodnisoudpraha1"
    ],
    "claimRefs": [
      "CLM-01",
      "CLM-02"
    ],
    "sourceRefs": [
      "SRC-01"
    ],
    "depth": 1
  },
  "content": [
    {
      "type": "markdown",
      "value": "Kontextová entita — uvedena, protože se přímo objevuje v citovaném zpravodajství o autorizovaném tématu. Tato stránka neobsahuje samostatný profil mimo tento kontext."
    }
  ]
}
