{
 "$schema": "https://vomaste.cz/schemas/canonical/entity.schema.json",
 "schemaVersion": 1,
 "@context": "https://vomaste.cz/context/v1.jsonld",
 "@id": "https://vomaste.cz/id/entities/frantisek-fabicovic",
 "@type": "vomaste:Entity",
 "recordType": "entity",
 "identifier": "frantisek-fabicovic",
 "entityId": "frantisek-fabicovic",
 "title": "František Fabičovic",
 "entityType": "person",
 "publicationRole": "context",
 "dossierEnabled": false,
 "dossierStatus": "not_authorized",
 "coverageState": "discovered",
 "dossiers": [
  "macinka-turek"
 ],
 "order": 132,
 "provenance": {
  "discoveredAt": "2026-08-02",
  "discoveredVia": [
   "content-extraction-2026-08-02"
  ],
  "claimRefs": [
   "CLM-35"
  ],
  "sourceRefs": [
   "SRC-39"
  ]
 },
 "content": [
  {
   "type": "markdown",
   "value": "Kontextová entita — Podnikatel, dárce 1 mil. Kč Motoristům sobě před volbami 2025; dlouholetý přítel otce Petra Macinky, kterého zaměstnává na hudební vystoupení. Uvedena, protože se jmenovitě objevuje v citovaném obsahu autorizovaných dossierů (macinka-turek). Tato stránka neobsahuje samostatný profil mimo tento kontext a nezakládá žádné tvrzení o pochybení."
  }
 ]
}
