{
  "$schema": "https://vomaste.cz/schemas/canonical/entity.schema.json",
  "schemaVersion": 1,
  "@context": "https://vomaste.cz/context/v1.jsonld",
  "@id": "https://vomaste.cz/id/entities/petr-sokol",
  "@type": "vomaste:Entity",
  "recordType": "entity",
  "identifier": "petr-sokol",
  "entityId": "petr-sokol",
  "title": "Petr Sokol",
  "entityType": "person",
  "publicationRole": "subject",
  "dossierEnabled": true,
  "dossierStatus": "authorized",
  "coverageState": "discovered",
  "dossiers": [
    "petr-sokol"
  ],
  "order": 529,
  "provenance": {
    "discoveredAt": "2026-08-06",
    "discoveredVia": [
      "opozice-25-politiku-2026-08-06"
    ]
  },
  "content": [
    {
      "type": "markdown",
      "value": "Kontextová entita — poslanec ODS (psp.cz id 7045), místopředseda poslaneckého klubu ODS, stínový poradce pro EU ve stínové vládě ODS. Politolog a publicista stejného jména je tatáž osoba, nikoli jmenovec."
    }
  ]
}
