{
 "$schema": "https://vomaste.cz/schemas/canonical/entity.schema.json",
 "schemaVersion": 1,
 "@context": "https://vomaste.cz/context/v1.jsonld",
 "@id": "https://vomaste.cz/id/entities/spor-o-statni-rozpocet-2026",
 "@type": "vomaste:Entity",
 "recordType": "entity",
 "identifier": "spor-o-statni-rozpocet-2026",
 "entityId": "spor-o-statni-rozpocet-2026",
 "title": "Spor o soulad státního rozpočtu 2026 se zákonem o rozpočtové odpovědnosti",
 "entityType": "controversy",
 "publicationRole": "context",
 "dossierEnabled": false,
 "dossierStatus": "not_authorized",
 "coverageState": "discovered",
 "dossiers": [
  "alena-schillerova"
 ],
 "order": 388,
 "provenance": {
  "discoveredAt": "2026-08-02",
  "discoveredVia": [
   "content-extraction-2026-08-02"
  ],
  "claimRefs": [
   "CLM-03",
   "CLM-04",
   "CLM-24",
   "CLM-25"
  ],
  "sourceRefs": [
   "SRC-02",
   "SRC-18"
  ]
 },
 "content": [
  {
   "type": "markdown",
   "value": "Kontextová entita — NRR označila návrh rozpočtu (schodek 310 mld.) za rozporný se zákonem (limit 246–247 mld.); MF a ministryně výpočet rozporují (292 mld.). Neuzavřený spor, předchází novele. Uvedena, protože se jmenovitě objevuje v citovaném obsahu autorizovaných dossierů (alena-schillerova). Tato stránka neobsahuje samostatný profil mimo tento kontext a nezakládá žádné tvrzení o pochybení."
  }
 ]
}
